{
  "access": {
    "authentication": "none",
    "contains_personal_data": false,
    "contains_protected_data": false,
    "publication_classification": "public",
    "read_only": true,
    "tier": "open"
  },
  "canonicalisation": "rfc8785-jcs",
  "construction": {
    "product": "gis-ai-go-gateway",
    "profile": "anonymous-open",
    "source": "server"
  },
  "context_id": "gis-ai-go:public-authority-context:sha256:cc90ac84527a6a85bc3e02529b5b4422d1a7bdf5bdcd77346a78006eeca1d34c",
  "evidence": {
    "attestation": "not-attested",
    "persistence": "not-persisted",
    "receipt": "inline-required"
  },
  "permitted_operations": [
    "catalogue.describe",
    "catalogue.search"
  ],
  "schema": "gis-ai-go.public-authority-context.v1"
}
